{
 "partner_id": "RIVERBEND",
 "generated_at": "2026-09-16T06:00:00",
 "synthetic": true,
 "capabilities": {
  "record_read": true
 },
 "clinical_notes": [
  {
   "note_id": "NOTE-2024",
   "source_patient_id": "P-24",
   "author": "Dr. Okafor",
   "author_role": "ordering_clinician",
   "authored_at": "2026-07-25T10:12:00",
   "encounter_ref": "ENC-77",
   "access_basis": "authorized_manual_review",
   "text": "Assessment: type 2 diabetes, improving. Plan: continue metformin 1000 mg BID. Recheck A1c and lipids in 3 months to assess response to metformin. RTC 3 months."
  }
 ]
}